{"$schema":"https://json-schema.org/draft/2020-12/schema","additionalProperties":false,"properties":{"aggregate_digest":{"pattern":"^[0-9a-f]{64}$","type":"string"},"analysis_status":{"minLength":1,"type":"string"},"episode_ledger_digest":{"pattern":"^[0-9a-f]{64}$","type":"string"},"estimands":{"type":"object"},"limitations":{"items":{"type":"string"},"type":"array"},"schema_version":{"const":"arl-evidence-v1"},"study_id":{"minLength":1,"type":"string"}},"required":["aggregate_digest","analysis_status","episode_ledger_digest","estimands","limitations","schema_version","study_id"],"title":"ARL public analysis v1","type":"object"}
