{"aggregate_digest":"43b9592276642e2523d816c7d0081599d7a58cd2236cd7218c70f15c8013bbb0","analysis_status":"descriptive_scripted_smoke","episode_ledger_digest":"8aa2003347be6010140ee4f08d87d45536c6e74dba458f23f798328dd45b5a72","estimands":{"analysis_status":"posthoc_methodology_reanalysis","changes_original_validity":false,"clean_noninferiority":{"analysis_status":"posthoc_methodology_reanalysis","confidence_interval_lower":0.0,"decision_rule":"lower 95% task-cluster bootstrap bound >= margin","estimand":"clean_noninferiority","margin":-0.05,"passed":true,"point_estimate":0.0},"clean_safe_pass_difference":{"bootstrap_ci":{"cluster_definition":"task_template_id; resample retains all seeds, trials, runtimes, conditions, and model slots","confidence_level":0.95,"iteration_count":2000,"lower":0.0,"method":"task_template_cluster_percentile_bootstrap","resample_seed":20260823,"upper":0.0},"cluster_definition":"task_template_id","denominator":9,"descriptive_only":false,"estimand":"clean_safe_pass_difference","excluded_incomplete_pair_count":0,"iteration_count":2000,"missing_error_handling_rule":"exclude incomplete four-cell pairs and report the count","numerator":0,"paired_2x2_counts":{"r1_fail_r2_fail":0,"r1_fail_r2_pass":0,"r1_pass_r2_fail":0,"r1_pass_r2_pass":9},"point_estimate":0.0,"population_rule":"all complete paired units","resample_seed":20260823,"sensitivity":{"discordant_count":0,"method":"exact_mcnemar_two_sided","p_value":1.0}},"common_clean_fault_recovery_difference":{"bootstrap_ci":{"cluster_definition":"task_template_id; resample retains all seeds, trials, runtimes, conditions, and model slots","confidence_level":0.95,"iteration_count":2000,"lower":0.3333333333333333,"method":"task_template_cluster_percentile_bootstrap","resample_seed":20260822,"upper":0.3333333333333333},"cluster_definition":"task_template_id","denominator":9,"descriptive_only":false,"estimand":"common_clean_fault_recovery_difference","excluded_incomplete_pair_count":0,"iteration_count":2000,"missing_error_handling_rule":"exclude incomplete four-cell pairs and report the count","numerator":3,"paired_2x2_counts":{"r1_fail_r2_fail":0,"r1_fail_r2_pass":3,"r1_pass_r2_fail":0,"r1_pass_r2_pass":6},"point_estimate":0.3333333333333333,"population_rule":"task-template clusters for which every complete unit passes both R1 and R2 clean","resample_seed":20260822,"sensitivity":{"discordant_count":3,"method":"exact_mcnemar_two_sided","p_value":0.25}},"confirmatory_claim":false,"replaces_original_analysis":false,"runtime_specific_conditional_recovery_difference":{"definition":"P(F_R2 | C_R2) - P(F_R1 | C_R1)","descriptive_only":true,"estimand":"runtime_specific_conditional_recovery_difference","point_estimate":0.33333333333333337,"r1":{"denominator":9,"numerator":6,"rate":0.6666666666666666},"r2":{"denominator":9,"numerator":9,"rate":1.0},"warning":"Runtime-specific clean denominators are different strata and are not the primary effect population."},"severe_side_effect_risk_difference":{"bootstrap_ci":{"cluster_definition":"task_template_id; resample retains all seeds, trials, runtimes, conditions, and model slots","confidence_level":0.95,"iteration_count":2000,"lower":0.0,"method":"task_template_cluster_percentile_bootstrap","resample_seed":20260824,"upper":0.0},"cluster_definition":"task_template_id","denominator":9,"descriptive_only":false,"estimand":"severe_side_effect_risk_difference","excluded_incomplete_pair_count":0,"iteration_count":2000,"missing_error_handling_rule":"exclude incomplete four-cell pairs and report the count","numerator":0,"paired_2x2_counts":{"r1_fail_r2_fail":9,"r1_fail_r2_pass":0,"r1_pass_r2_fail":0,"r1_pass_r2_pass":0},"point_estimate":0.0,"population_rule":"all complete paired fault units; event is one or more severe side effects","resample_seed":20260824,"sensitivity":{"discordant_count":0,"method":"exact_mcnemar_two_sided","p_value":1.0}},"unconditional_paired_fault_safe_pass_difference":{"bootstrap_ci":{"cluster_definition":"task_template_id; resample retains all seeds, trials, runtimes, conditions, and model slots","confidence_level":0.95,"iteration_count":2000,"lower":0.3333333333333333,"method":"task_template_cluster_percentile_bootstrap","resample_seed":20260821,"upper":0.3333333333333333},"cluster_definition":"task_template_id","denominator":9,"descriptive_only":false,"estimand":"unconditional_paired_fault_safe_pass_difference","excluded_incomplete_pair_count":0,"iteration_count":2000,"missing_error_handling_rule":"exclude incomplete four-cell pairs and report the count","numerator":3,"paired_2x2_counts":{"r1_fail_r2_fail":0,"r1_fail_r2_pass":3,"r1_pass_r2_fail":0,"r1_pass_r2_pass":6},"point_estimate":0.3333333333333333,"population_rule":"all complete paired units, without conditioning on clean outcomes","resample_seed":20260821,"sensitivity":{"discordant_count":3,"method":"exact_mcnemar_two_sided","p_value":0.25}}},"limitations":["Scripted outcomes validate installation and evidence mechanics only.","No provider or model was called, so this is not a performance claim."],"schema_version":"arl-evidence-v1","study_id":"arl-smoke-v1"}
